{
  "$schema": "evaluation-config.schema.json",
  "schema_version": "phase-08-profile-evaluation-config.v1",
  "package_id": "phase-08-profile-evaluation@1",
  "implementation_freeze_commit": "473a53ace895bab62459f57f3d0fe2d05e1e19ee",
  "evaluation_cutoff": "2026-08-14",
  "observation_timestamp": "2026-08-11T10:12:00Z",
  "currency": "USD",
  "regions": {
    "aws": "eu-central-1",
    "azure": "westeurope",
    "gcp": "europe-west1"
  },
  "runtime": {
    "host_platform": "darwin-arm64",
    "container_platform": "linux-arm64",
    "python_version": "3.11",
    "container_images": [
      {
        "service": "optimizer",
        "digest": "sha256:9e501de37225f0bbd2dfddb5633f5058e189c8e3a062949053809a0bbcde2034"
      },
      {
        "service": "management-api",
        "digest": "sha256:6acd3e85bbefdf390f121c989591a04f5c37217f6f3ce43b634ed6c62acf07df"
      },
      {
        "service": "deployer",
        "digest": "sha256:71bf1a1e57bd709e5f246ff973df762c5246dd22210a431e0c67abce14f9a3f8"
      },
      {
        "service": "docs",
        "digest": "sha256:e5e4df65053c975205a106de376fd8c2ebcb574f29a16eaee61d8521b6e34558"
      }
    ]
  },
  "generator": {
    "id": "phase-08-profile-evaluation-generator",
    "version": "1.0.0",
    "command": "python scripts/phase_08_profile_evaluation/generate.py",
    "container_command": "docker --context orbstack compose run --rm --no-deps -v $PWD:/workspace -w /workspace 2twin2clouds python scripts/phase_08_profile_evaluation/generate.py"
  },
  "historical_scenarios": [
    {
      "scenario_id": "historical-base-v1",
      "input_path": "2-twin2clouds/example_input.json",
      "overrides": {
        "entityCount": 100
      }
    },
    {
      "scenario_id": "historical-edge-heavy-v1",
      "input_path": "2-twin2clouds/example_input.json",
      "overrides": {
        "numberOfDevices": 10000,
        "averageSizeOfMessageInKb": 256.0,
        "deviceSendingIntervalInMinutes": 1.0,
        "entityCount": 10000
      }
    }
  ],
  "representative_three_provider_placements": {
    "small": {
      "component.ingestion": "aws",
      "component.eventing": "azure",
      "component.processing": "gcp",
      "component.hot-storage": "gcp",
      "component.cool-storage": "gcp",
      "component.archive-storage": "gcp",
      "component.twin-state": "azure",
      "component.visualization": "gcp"
    },
    "medium": {
      "component.ingestion": "azure",
      "component.eventing": "gcp",
      "component.processing": "aws",
      "component.hot-storage": "aws",
      "component.cool-storage": "azure",
      "component.archive-storage": "azure",
      "component.twin-state": "gcp",
      "component.visualization": "aws"
    },
    "large": {
      "component.ingestion": "gcp",
      "component.eventing": "aws",
      "component.processing": "azure",
      "component.hot-storage": "azure",
      "component.cool-storage": "gcp",
      "component.archive-storage": "gcp",
      "component.twin-state": "aws",
      "component.visualization": "azure"
    }
  }
}
